index,start,end,text
165,00:55:13:240,00:55:42:039," because it will definitely affect the behavior. I'm not sure exactly how yet.  I don't know of any results that ask this particular question.  Okay, so I had one more question in the W-hardness result that you presented.  So do you know like the length of the the the length of the changes are actually the  number of changes or flips that you make in your independent set? This is just."
166,00:55:29:079,00:55:59:880," So do you know like the length of the the the length of the changes are actually the  number of changes or flips that you make in your independent set? This is just.  Yes, yes, yes. We do. So here the number of changes is going to be very it's it's  basically going to be the shortest possible sequence. So it's it's going to it's it's  basically going to be so if you think about the simple construction, this one."
167,00:55:49:000,00:56:18:599," basically going to be the shortest possible sequence. So it's it's going to it's it's  basically going to be so if you think about the simple construction, this one.  It's basically literally going to be these guys are going to move here. So each is going to cost  me one slide and then they're all going to and now this guy is going to move here. And now I will pay  one slide for each one here. Now this is the simplified version of it. Once you go to the"
168,00:56:05:559,00:56:42:039," me one slide and then they're all going to and now this guy is going to move here. And now I will pay  one slide for each one here. Now this is the simplified version of it. Once you go to the  complete version of it, you have some extra slides within the path, but you can also count those.  Okay, so but does this mean that so does this mean that at a particular vertex, we're  placing the token at most once? In this case, yes. Okay. In this case, yes. Okay. So this problem"
169,00:56:23:960,00:57:02:680," Okay, so but does this mean that so does this mean that at a particular vertex, we're  placing the token at most once? In this case, yes. Okay. In this case, yes. Okay. So this problem  should be hard, even if we bound the number of times tokens can be moved to a vertex, right?  Should be hard, even if we bound the number of times tokens can be moved to a vertex, right?  Yes. Okay. Yes. So so here in this case, yes. Absolutely. Okay. Thanks."
170,00:56:47:400,00:57:25:480," Should be hard, even if we bound the number of times tokens can be moved to a vertex, right?  Yes. Okay. Yes. So so here in this case, yes. Absolutely. Okay. Thanks.  So Akanksha, I have a remark about your question. So if a vertex, if a vertex cannot get a token  twice, then it somehow seems to be selecting disjoint independent sets,  a sequence of them, and that may have some bearing on coloring, just a top level."
171,00:57:12:920,00:57:49:320," twice, then it somehow seems to be selecting disjoint independent sets,  a sequence of them, and that may have some bearing on coloring, just a top level.  So actually, for the list, the W harness case that I'm in presented, it is exactly the case,  right? So we are not allowed to move the token, like twice on the same vertex.  Yeah. So I didn't get your point of moving. So getting this disjoint independence, it's actually"
172,00:57:35:960,00:58:08:280," right? So we are not allowed to move the token, like twice on the same vertex.  Yeah. So I didn't get your point of moving. So getting this disjoint independence, it's actually  because if you say if you think of it from my the way I thought about it, right, that you are  actually trying to find a path in a large graph where every vertex corresponds to an independent  set, and you move from one independent set to another. So we can only move from one independent"
173,00:57:55:159,00:58:28:519," actually trying to find a path in a large graph where every vertex corresponds to an independent  set, and you move from one independent set to another. So we can only move from one independent  set to the other, if the changes is like in case of tokens sliding, it's one probably.  Yeah.  So it looks to me that you're asking for a collection of independent sets,"
174,00:58:17:400,00:58:48:680," Yeah.  So it looks to me that you're asking for a collection of independent sets,  which are vertex disjoint, if the token sequence of independent sets which are vertex disjoint.  Yeah. So if I may, I think Akansha's question would be more relevant in a place where we don't  have a monotone sequence, meaning a sequence. So we need a version of the problem or some cases of"
175,00:58:34:840,00:59:08:360," Yeah. So if I may, I think Akansha's question would be more relevant in a place where we don't  have a monotone sequence, meaning a sequence. So we need a version of the problem or some cases of  the problem where a vertex has to be visited multiple times to find solutions. And that is  known to be the case for some versions or some statements of the problem. And in fact, Akansha,  so this was the crucial difference between PSPACE completeness and NP completeness of sliding versus"
176,00:58:55:160,00:59:31:720," known to be the case for some versions or some statements of the problem. And in fact, Akansha,  so this was the crucial difference between PSPACE completeness and NP completeness of sliding versus  jumping in bipartite graphs. So it was because we were able to show that no vertex will be visited  more than once in the other problems. So that's why it's definitely an interesting question to  pose, but you have to be careful in what context you pose it. I don't know if that kind of settles"
177,00:59:15:080,01:00:20:360," more than once in the other problems. So that's why it's definitely an interesting question to  pose, but you have to be careful in what context you pose it. I don't know if that kind of settles  answers your question. Yes, yes, it does. All right. Thanks. You're welcome.  Any more questions?  I guess not."
178,00:59:39:079,01:00:38:679," Any more questions?  I guess not.  Yeah, I don't think there are any more questions. I will just once again announce the parameterized  algorithm 301 workshop, which is going to happen in December. And the link has been posted once  again in the chat. Some advanced topics in parameterized complexity will be discussed."
179,01:00:27:400,01:01:15:000," algorithm 301 workshop, which is going to happen in December. And the link has been posted once  again in the chat. Some advanced topics in parameterized complexity will be discussed.  Those interested can have a look and register for it.  And yeah, if there are any more questions, please ask away.  Oh, so anyone can register for the"
180,01:00:43:640,01:01:30:360," And yeah, if there are any more questions, please ask away.  Oh, so anyone can register for the  school? Yes, yes, anyone can.  Yeah, it's free and it's online and yeah, it's open to everyone.  Awesome. So I can share it with my students as well."
181,01:01:23:400,01:01:46:680," Yeah, it's free and it's online and yeah, it's open to everyone.  Awesome. So I can share it with my students as well.  Of course, of course, please do. Yeah, that would be good. And we assumed some basic  understanding of parameterized algorithms, but we have already shared a link on the page  where students can go and go through some previous lectures in parameterized algorithms if"
182,01:01:34:920,01:02:10:920," understanding of parameterized algorithms, but we have already shared a link on the page  where students can go and go through some previous lectures in parameterized algorithms if  they wish to just brace up or revise stuff.  All right, so I guess, okay, I don't think there are any more questions.  So maybe this is a good time to wrap up. So thank you once again Professor Amedoh for"
183,01:01:57:639,01:02:27:000," All right, so I guess, okay, I don't think there are any more questions.  So maybe this is a good time to wrap up. So thank you once again Professor Amedoh for  agreeing to give the talk. It was really nice to have you and it was really good to have something  different than what we usually hear in every parameterized complexity talk, at least most  of them. So and yeah, these are really interesting problems to think upon. And thank you to the"
